{
  "schema_version": "1.0",
  "event_id": "33333333-3333-3333-3333-333333333333",
  "timestamp": "2026-07-22T12:10:00Z",
  "friction": { "score": 0.88, "sustained_minutes": 5, "delete_z": 2.1, "switch_z": 2.4, "cursor_z": 1.6 },
  "context": { "meeting_active": true, "screen_sharing": true, "fullscreen_active": true, "quiet_mode": false, "session_minutes": 80, "last_intervention_minutes": 60 },
  "preferences": { "preferred_recovery": "bubbles", "reduced_motion": false, "max_duration_seconds": 45 },
  "recent_feedback": "none"
}
